{
  "schema_version": 1,
  "target": {
    "jurisdiction": "132012",
    "fiscal_year": 2025,
    "document_kind": "settlement"
  },
  "direction": "expenditure",
  "conversions": [
    {
      "id": "general-settlement",
      "converter": "fiscal/jurisdictions/132012/layouts/text_settlement_report/convert.py",
      "inputs": [
        {
          "sha256": "4fce3f1c0fa18d24c537870bbf1abf37a9e954fc7efddb83254a5c6addf0ad02"
        }
      ],
      "options": {
        "account": "一般会計",
        "detail_table_id": "general-detail",
        "funding_table_id": "general-funding",
        "annex_table_id": "general-annex"
      },
      "expected_tables": [
        {
          "table_id": "general-detail"
        },
        {
          "table_id": "general-funding"
        },
        {
          "table_id": "general-annex"
        }
      ]
    }
  ],
  "tables": [
    {
      "table_id": "general-detail",
      "conversion_id": "general-settlement",
      "input_fingerprint": "b01ace534ffe6b898cfad0149d8819fe1c7ae87d2ba24d4209b6f76238ad072f",
      "object": {
        "key": "fiscal/ingestion/132012/2025/settlement/expenditure/general-detail.parquet",
        "sha256": "6db5af21b258fd012e10cca640b0be1368791a23c9713ec8f3eb64ef0d2c29f4",
        "bytes": 150183
      },
      "row_count": 1723,
      "metadata": {
        "units": [
          {
            "text": "円",
            "scope": {
              "kind": "columns",
              "columns": [
                "款_決算額",
                "款_国庫支出金",
                "款_都支出金",
                "款_市債",
                "款_その他",
                "款_一般財源",
                "目_予算現額",
                "目_当年度決算額",
                "目_前年度決算額",
                "事業_予算現額",
                "事業_当年度決算額",
                "事業_前年度決算額",
                "内訳_金額",
                "細目_金額"
              ]
            }
          }
        ],
        "notes": [
          {
            "text": "「主要な施策の成果・事務報告書」の歳出部（物理148-464頁）。行は最細の印字金額明細: 事業が（n）内訳項目＋アイウ細目を持てば細目行、内訳項目のみなら内訳行、内訳のない事業は事業行が葉。款・項・目・事業・内訳の名称・印字金額・位置を葉行へ反復する。項は独立した金額行を持たず、見出し行の金額3列は目の値。款_決算額等7列は款の先頭頁の集計行（単位 円、執行率は％）。事業の財源内訳は別表 funding、内表・歳出合計・決算総括・給与費決算明細は別表 annex。本資料は主要施策の抜粋であり、目→事業・款→目の合計検算は原則不成立。（予算現額）・<前年度決算額>は括弧・不等号を含む印字通りの文字列。",
            "scope": {
              "kind": "table"
            }
          }
        ],
        "column_contexts": [
          {
            "columns": [
              "款_番号",
              "款_名称",
              "款_決算額",
              "款_国庫支出金",
              "款_都支出金",
              "款_市債",
              "款_その他",
              "款_一般財源",
              "款_執行率",
              "款_物理頁",
              "款_上端",
              "款_下端"
            ],
            "header_path": [
              "科目",
              "款"
            ],
            "grain_columns": [
              "款_物理頁",
              "款_上端"
            ]
          },
          {
            "columns": [
              "項_番号",
              "項_名称",
              "項_物理頁",
              "項_上端",
              "項_下端"
            ],
            "header_path": [
              "科目",
              "項"
            ],
            "grain_columns": [
              "項_物理頁",
              "項_上端"
            ]
          },
          {
            "columns": [
              "目_番号",
              "目_名称",
              "目_予算現額",
              "目_当年度決算額",
              "目_前年度決算額",
              "目_物理頁",
              "目_上端",
              "目_下端"
            ],
            "header_path": [
              "科目",
              "目"
            ],
            "grain_columns": [
              "目_物理頁",
              "目_上端"
            ]
          },
          {
            "columns": [
              "事業_番号",
              "事業_名称",
              "事業_担当課",
              "事業_予算現額",
              "事業_当年度決算額",
              "事業_前年度決算額",
              "事業_説明",
              "事業_物理頁",
              "事業_上端",
              "事業_下端"
            ],
            "header_path": [
              "事業",
              "事業"
            ],
            "grain_columns": [
              "事業_物理頁",
              "事業_上端"
            ]
          },
          {
            "columns": [
              "内訳_番号",
              "内訳_名称",
              "内訳_金額",
              "内訳_物理頁",
              "内訳_上端",
              "内訳_下端",
              "細目_番号",
              "細目_名称",
              "細目_数量",
              "細目_金額",
              "細目_物理頁",
              "細目_上端",
              "細目_下端"
            ],
            "header_path": [
              "内訳",
              "細目"
            ],
            "grain_columns": [
              "細目_物理頁",
              "細目_上端"
            ]
          }
        ]
      }
    },
    {
      "table_id": "general-funding",
      "conversion_id": "general-settlement",
      "input_fingerprint": "b01ace534ffe6b898cfad0149d8819fe1c7ae87d2ba24d4209b6f76238ad072f",
      "object": {
        "key": "fiscal/ingestion/132012/2025/settlement/expenditure/general-funding.parquet",
        "sha256": "acabf049040f089d8465aaa75f6c25ba1f22f91e7483ef197ef88c49171ceed1",
        "bytes": 22857
      },
      "row_count": 1069,
      "metadata": {
        "units": [
          {
            "text": "円",
            "scope": {
              "kind": "columns",
              "columns": [
                "財源_金額"
              ]
            }
          }
        ],
        "notes": [
          {
            "text": "事業ブロック右欄の財源内訳。事業の当年度決算額の独立した印字分解であり、detail表の葉金額とは別の軸。ラベルが行またぎの場合は改行で保持。",
            "scope": {
              "kind": "table"
            }
          }
        ],
        "column_contexts": [
          {
            "columns": [
              "款_番号",
              "項_番号",
              "目_番号",
              "事業_番号",
              "事業_物理頁",
              "事業_上端",
              "財源_名称"
            ],
            "header_path": [
              "事業",
              "財源内訳"
            ],
            "grain_columns": [
              "事業_物理頁",
              "事業_上端",
              "財源_上端"
            ]
          }
        ]
      }
    },
    {
      "table_id": "general-annex",
      "conversion_id": "general-settlement",
      "input_fingerprint": "b01ace534ffe6b898cfad0149d8819fe1c7ae87d2ba24d4209b6f76238ad072f",
      "object": {
        "key": "fiscal/ingestion/132012/2025/settlement/expenditure/general-annex.parquet",
        "sha256": "26767ca7e0cd50f48b12b5d012cc21d87aa0bbc084e4ab4492f4b94064128b55",
        "bytes": 326027
      },
      "row_count": 8385,
      "metadata": {
        "notes": [
          {
            "text": "歳出明細以外の全印字行（頁見出し・款集計行・説明以外の注記・内表・歳出合計・決算総括・給与費決算明細・頁脚）。1印字行=1行で原文保持。款_〜事業_列は行が属する見出しの原典座標。",
            "scope": {
              "kind": "table"
            }
          }
        ],
        "column_contexts": [
          {
            "columns": [
              "本文",
              "物理頁",
              "上端",
              "下端",
              "左端",
              "右端"
            ],
            "header_path": [
              "印字行"
            ],
            "grain_columns": [
              "物理頁",
              "上端"
            ]
          }
        ]
      }
    }
  ]
}
