{
  "schema_version": 1,
  "target": {
    "jurisdiction": "132047",
    "fiscal_year": 2023,
    "document_kind": "supplementary",
    "amendment_number": 3
  },
  "direction": "expenditure",
  "conversions": [
    {
      "id": "mitaka-supplementary-native-27ac14aee303a3cd",
      "converter": "fiscal/layouts/retained/convert.py",
      "inputs": [
        {
          "sha256": "9dd4a043c390fcb1a2da23097959b6f19f7a928b8c4d6bff14738c23cb5a987e"
        }
      ],
      "options": {
        "objects": [
          {
            "table_id": "mitaka-supplementary-native-27ac14aee303a3cd",
            "bytes": 6203,
            "key": "inputs/table/sha256/7764f2796b3358197615b81cb2b243806b12f9efc06d5ff8132e15aa888beec4",
            "sha256": "7764f2796b3358197615b81cb2b243806b12f9efc06d5ff8132e15aa888beec4"
          }
        ]
      },
      "expected_tables": [
        {
          "table_id": "mitaka-supplementary-native-27ac14aee303a3cd"
        }
      ]
    },
    {
      "id": "mitaka-supplementary-native-cf606a45379cd43b",
      "converter": "fiscal/layouts/retained/convert.py",
      "inputs": [
        {
          "sha256": "9dd4a043c390fcb1a2da23097959b6f19f7a928b8c4d6bff14738c23cb5a987e"
        }
      ],
      "options": {
        "objects": [
          {
            "table_id": "mitaka-supplementary-native-cf606a45379cd43b",
            "bytes": 8095,
            "key": "inputs/table/sha256/d6a61f4a520d1c4a4395c729fb0f5cca32f55945ed141ef78bbb23d871910c81",
            "sha256": "d6a61f4a520d1c4a4395c729fb0f5cca32f55945ed141ef78bbb23d871910c81"
          }
        ]
      },
      "expected_tables": [
        {
          "table_id": "mitaka-supplementary-native-cf606a45379cd43b"
        }
      ]
    },
    {
      "id": "mitaka-supplementary-native-979c9e3861711195",
      "converter": "fiscal/layouts/retained/convert.py",
      "inputs": [
        {
          "sha256": "9dd4a043c390fcb1a2da23097959b6f19f7a928b8c4d6bff14738c23cb5a987e"
        }
      ],
      "options": {
        "objects": [
          {
            "table_id": "mitaka-supplementary-native-979c9e3861711195",
            "bytes": 4859,
            "key": "inputs/table/sha256/f6c6cac6f3f3d4604380eb0e71014c03199b5f44718fcf1d07bf0d01fbe7a09b",
            "sha256": "f6c6cac6f3f3d4604380eb0e71014c03199b5f44718fcf1d07bf0d01fbe7a09b"
          }
        ]
      },
      "expected_tables": [
        {
          "table_id": "mitaka-supplementary-native-979c9e3861711195"
        }
      ]
    },
    {
      "id": "mitaka-supplementary-native-e133e1aef3769ba4",
      "converter": "fiscal/layouts/retained/convert.py",
      "inputs": [
        {
          "sha256": "9dd4a043c390fcb1a2da23097959b6f19f7a928b8c4d6bff14738c23cb5a987e"
        }
      ],
      "options": {
        "objects": [
          {
            "table_id": "mitaka-supplementary-native-e133e1aef3769ba4",
            "bytes": 15653,
            "key": "inputs/table/sha256/a928e2f5b988c6c24ffe526b071712d50bd6fa44ace37158dbc897d9794686cb",
            "sha256": "a928e2f5b988c6c24ffe526b071712d50bd6fa44ace37158dbc897d9794686cb"
          }
        ]
      },
      "expected_tables": [
        {
          "table_id": "mitaka-supplementary-native-e133e1aef3769ba4"
        }
      ]
    }
  ],
  "tables": [
    {
      "table_id": "mitaka-supplementary-native-27ac14aee303a3cd",
      "conversion_id": "mitaka-supplementary-native-27ac14aee303a3cd",
      "input_fingerprint": "4cfc69fc969cbcfbe7b6bd2b18e4566f1aa55310cec639ff55dcd1c5e6509043",
      "object": {
        "key": "fiscal/ingestion/132047/2023/supplementary-3/expenditure/mitaka-supplementary-native-27ac14aee303a3cd.parquet",
        "sha256": "7764f2796b3358197615b81cb2b243806b12f9efc06d5ff8132e15aa888beec4",
        "bytes": 6203
      },
      "row_count": 8
    },
    {
      "table_id": "mitaka-supplementary-native-cf606a45379cd43b",
      "conversion_id": "mitaka-supplementary-native-cf606a45379cd43b",
      "input_fingerprint": "22c75af106422c0d2aa0a725f1a8a641fc664947d9fcfe15e336090626c7bef6",
      "object": {
        "key": "fiscal/ingestion/132047/2023/supplementary-3/expenditure/mitaka-supplementary-native-cf606a45379cd43b.parquet",
        "sha256": "d6a61f4a520d1c4a4395c729fb0f5cca32f55945ed141ef78bbb23d871910c81",
        "bytes": 8095
      },
      "row_count": 20
    },
    {
      "table_id": "mitaka-supplementary-native-979c9e3861711195",
      "conversion_id": "mitaka-supplementary-native-979c9e3861711195",
      "input_fingerprint": "a392c580213e6faff88ba79485108cf406eefad2c89496e062d5633421b2e0b8",
      "object": {
        "key": "fiscal/ingestion/132047/2023/supplementary-3/expenditure/mitaka-supplementary-native-979c9e3861711195.parquet",
        "sha256": "f6c6cac6f3f3d4604380eb0e71014c03199b5f44718fcf1d07bf0d01fbe7a09b",
        "bytes": 4859
      },
      "row_count": 1
    },
    {
      "table_id": "mitaka-supplementary-native-e133e1aef3769ba4",
      "conversion_id": "mitaka-supplementary-native-e133e1aef3769ba4",
      "input_fingerprint": "4ee3fa930c58b792cd5463ca6b3adb7e6f5026cf65be878db18d1936eaf0514c",
      "object": {
        "key": "fiscal/ingestion/132047/2023/supplementary-3/expenditure/mitaka-supplementary-native-e133e1aef3769ba4.parquet",
        "sha256": "a928e2f5b988c6c24ffe526b071712d50bd6fa44ace37158dbc897d9794686cb",
        "bytes": 15653
      },
      "row_count": 96
    }
  ]
}
