{
  "schema_version": 1,
  "target": {
    "jurisdiction": "132098",
    "fiscal_year": 2025,
    "document_kind": "settlement"
  },
  "direction": "expenditure",
  "conversions": [
    {
      "id": "long-term-care-settlement",
      "converter": "fiscal/layouts/generic_text/convert.py",
      "inputs": [
        {
          "sha256": "a8315debb114272c77e6d3c88a81490a712a75f3b995ba755c97438fcef8f0a0"
        }
      ],
      "options": {
        "account": "介護保険事業会計",
        "table_id": "long-term-care-expenditure"
      },
      "expected_tables": [
        {
          "table_id": "long-term-care-expenditure"
        }
      ]
    },
    {
      "id": "national-health-insurance-settlement",
      "converter": "fiscal/layouts/generic_text/convert.py",
      "inputs": [
        {
          "sha256": "a8315debb114272c77e6d3c88a81490a712a75f3b995ba755c97438fcef8f0a0"
        }
      ],
      "options": {
        "account": "国民健康保険事業会計",
        "table_id": "national-health-insurance-expenditure"
      },
      "expected_tables": [
        {
          "table_id": "national-health-insurance-expenditure"
        }
      ]
    },
    {
      "id": "elderly-medical-settlement",
      "converter": "fiscal/layouts/generic_text/convert.py",
      "inputs": [
        {
          "sha256": "a8315debb114272c77e6d3c88a81490a712a75f3b995ba755c97438fcef8f0a0"
        }
      ],
      "options": {
        "account": "後期高齢者医療事業会計",
        "table_id": "elderly-medical-expenditure"
      },
      "expected_tables": [
        {
          "table_id": "elderly-medical-expenditure"
        }
      ]
    },
    {
      "id": "land-readjustment-settlement",
      "converter": "fiscal/layouts/generic_text/convert.py",
      "inputs": [
        {
          "sha256": "a8315debb114272c77e6d3c88a81490a712a75f3b995ba755c97438fcef8f0a0"
        }
      ],
      "options": {
        "account": "鶴川駅南土地区画整理事業会計",
        "table_id": "land-readjustment-expenditure"
      },
      "expected_tables": [
        {
          "table_id": "land-readjustment-expenditure"
        }
      ]
    },
    {
      "id": "general-settlement",
      "converter": "fiscal/layouts/generic_text/convert.py",
      "inputs": [
        {
          "sha256": "a8315debb114272c77e6d3c88a81490a712a75f3b995ba755c97438fcef8f0a0"
        }
      ],
      "options": {
        "account": "一般会計",
        "table_id": "general-expenditure"
      },
      "expected_tables": [
        {
          "table_id": "general-expenditure"
        }
      ]
    }
  ],
  "tables": [
    {
      "table_id": "long-term-care-expenditure",
      "conversion_id": "long-term-care-settlement",
      "input_fingerprint": "25307d4f399969e736314b2631e2ae2acec0dbf348d0f1dad4e1cbed36801f9d",
      "account": "介護保険事業会計",
      "notes": [
        "汎用のノード生成機（docs/prd/generic-node-builder）が選定の scope の頁を罫線・見出し・字下げ・番号から読んだ。科目の段は bands、内訳の段は {'備考': 'position', '節': 'indent'}。",
        "金額の単位は column mark 7頁 から決めた。款の和 40,648,455,051 と印字の「歳出合計」40,648,455,051 が一致。",
        "金額の注記 2 件（流用 2）を注記軸に置いた。",
        "共有辞書に無い金額の見出し 2 種（156 件）を、印字された語から辞書の見出しに寄せた: 予算現額／節／金額→節／金額・翌年度繰越額／継続費逓次繰越繰越明許費事故繰越→翌年度繰越額。"
      ],
      "unread_amount_count": 0,
      "unresolved_parent_count": 0,
      "nodes": {
        "object": {
          "key": "fiscal/ingestion/132098/2025/settlement/expenditure/long-term-care-expenditure-nodes.parquet",
          "sha256": "d12ab76d2ca8e4c1435143d76296dc9b02f823e1a315f2d3931e17fdc99a094d",
          "bytes": 10369
        },
        "row_count": 171
      },
      "amounts": {
        "object": {
          "key": "fiscal/ingestion/132098/2025/settlement/expenditure/long-term-care-expenditure-amounts.parquet",
          "sha256": "0061742baef0f2b03544303636e2756569ad2ce5ebb390853e67cd741b407aa8",
          "bytes": 13224
        },
        "row_count": 614
      }
    },
    {
      "table_id": "national-health-insurance-expenditure",
      "conversion_id": "national-health-insurance-settlement",
      "input_fingerprint": "ca4d0fb4f39ce00cdb55e204e719aa3d3b3127c63bd192d6a5d0a8d919421ef0",
      "account": "国民健康保険事業会計",
      "notes": [
        "汎用のノード生成機（docs/prd/generic-node-builder）が選定の scope の頁を罫線・見出し・字下げ・番号から読んだ。科目の段は bands、内訳の段は {'備考': 'position', '節': 'indent'}。",
        "金額の単位は column mark 5頁 から決めた。款の和 39,569,525,456 と印字の「歳出合計」39,569,525,456 が一致。",
        "金額の注記 1 件（流用 1）を注記軸に置いた。",
        "共有辞書に無い金額の見出し 2 種（129 件）を、印字された語から辞書の見出しに寄せた: 予算現額／節／金額→節／金額・翌年度繰越額／継続費逓次繰越繰越明許費事故繰越→翌年度繰越額。"
      ],
      "unread_amount_count": 0,
      "unresolved_parent_count": 0,
      "nodes": {
        "object": {
          "key": "fiscal/ingestion/132098/2025/settlement/expenditure/national-health-insurance-expenditure-nodes.parquet",
          "sha256": "7c4683d5cfda083845e65bedd91e3fcf02e94aeea1f78b613a3254364ec0f9da",
          "bytes": 9510
        },
        "row_count": 150
      },
      "amounts": {
        "object": {
          "key": "fiscal/ingestion/132098/2025/settlement/expenditure/national-health-insurance-expenditure-amounts.parquet",
          "sha256": "0f32772aae30a98832930fb00b2260530a77699926372d03bac9e11d8b214337",
          "bytes": 12599
        },
        "row_count": 602
      }
    },
    {
      "table_id": "elderly-medical-expenditure",
      "conversion_id": "elderly-medical-settlement",
      "input_fingerprint": "63b4cdeef49c91b3be707da909820dca54afeea5ab5ce80a40adbf409e10f138",
      "account": "後期高齢者医療事業会計",
      "notes": [
        "汎用のノード生成機（docs/prd/generic-node-builder）が選定の scope の頁を罫線・見出し・字下げ・番号から読んだ。科目の段は bands、内訳の段は {'備考': 'position', '節': 'indent'}。",
        "金額の単位は column mark 2頁 から決めた。款の和 15,124,016,462 と印字の「歳出合計」15,124,016,462 が一致。",
        "金額の注記 1 件（流用 1）を注記軸に置いた。",
        "共有辞書に無い金額の見出し 2 種（71 件）を、印字された語から辞書の見出しに寄せた: 予算現額／節／金額→節／金額・翌年度繰越額／継続費逓次繰越繰越明許費事故繰越→翌年度繰越額。"
      ],
      "unread_amount_count": 0,
      "unresolved_parent_count": 0,
      "nodes": {
        "object": {
          "key": "fiscal/ingestion/132098/2025/settlement/expenditure/elderly-medical-expenditure-nodes.parquet",
          "sha256": "53320fe93f6bc213f993ad42eea3c3de8a9c08e1a3f245fc8dfe1c5b7271746f",
          "bytes": 6124
        },
        "row_count": 73
      },
      "amounts": {
        "object": {
          "key": "fiscal/ingestion/132098/2025/settlement/expenditure/elderly-medical-expenditure-amounts.parquet",
          "sha256": "0a118fdb3e976fd62e10a393994eb58965a43be6e0e9ef1325270ab5b7cbda88",
          "bytes": 7800
        },
        "row_count": 306
      }
    },
    {
      "table_id": "land-readjustment-expenditure",
      "conversion_id": "land-readjustment-settlement",
      "input_fingerprint": "7b9c43388c3c7599634f5b97fd9cc5f7743ff8071513f6b4f05a79a4563e9680",
      "account": "鶴川駅南土地区画整理事業会計",
      "notes": [
        "汎用のノード生成機（docs/prd/generic-node-builder）が選定の scope の頁を罫線・見出し・字下げ・番号から読んだ。科目の段は bands、内訳の段は {'備考': 'position', '節': 'indent'}。",
        "金額の単位は column mark 2頁 から決めた。款の和 1,888,298,350 と印字の「歳出合計」1,888,298,350 が一致。",
        "金額の注記 1 件（不用額 1）を注記軸に置いた。",
        "共有辞書に無い金額の見出し 2 種（40 件）を、印字された語から辞書の見出しに寄せた: 予算現額／節／金額→節／金額・翌年度繰越額／継続費逓次繰越繰越明許費事故繰越→翌年度繰越額。"
      ],
      "unread_amount_count": 0,
      "unresolved_parent_count": 0,
      "nodes": {
        "object": {
          "key": "fiscal/ingestion/132098/2025/settlement/expenditure/land-readjustment-expenditure-nodes.parquet",
          "sha256": "12dde0494fe0f30bfbd3343c77dec79d3a5758f9eb77d7b5790086473c80184f",
          "bytes": 4724
        },
        "row_count": 43
      },
      "amounts": {
        "object": {
          "key": "fiscal/ingestion/132098/2025/settlement/expenditure/land-readjustment-expenditure-amounts.parquet",
          "sha256": "fa2fc1961ae8424fe11bfaef002abf92c663e4b8b963ef1371a801d9f820f279",
          "bytes": 5916
        },
        "row_count": 191
      }
    },
    {
      "table_id": "general-expenditure",
      "conversion_id": "general-settlement",
      "input_fingerprint": "0802b6d2370da5c8d3958ff5b8e230cd43f0065b56c9f377b4bf6d76a434d756",
      "account": "一般会計",
      "notes": [
        "汎用のノード生成機（docs/prd/generic-node-builder）が選定の scope の頁を罫線・見出し・字下げ・番号から読んだ。科目の段は bands、内訳の段は {'備考': 'position', '節': 'indent'}。",
        "金額の単位は column mark 105頁 から決めた。款の和 202,880,996,944 と印字の「歳出合計」202,880,996,944 が一致。",
        "金額の注記 300 件（不用額 20・充用 10・流用 270）を注記軸に置いた。",
        "共有辞書に無い金額の見出し 2 種（2300 件）を、印字された語から辞書の見出しに寄せた: 予算現額／節／金額→節／金額・翌年度繰越額／継続費逓次繰越繰越明許費事故繰越→翌年度繰越額。"
      ],
      "unread_amount_count": 0,
      "unresolved_parent_count": 0,
      "nodes": {
        "object": {
          "key": "fiscal/ingestion/132098/2025/settlement/expenditure/general-expenditure-nodes.parquet",
          "sha256": "9952bbc60a930705d0e7e44b8a3e6822e5769470acac59a845431710e96ab0be",
          "bytes": 95596
        },
        "row_count": 3008
      },
      "amounts": {
        "object": {
          "key": "fiscal/ingestion/132098/2025/settlement/expenditure/general-expenditure-amounts.parquet",
          "sha256": "c7cf3732222cc346a687ffc0d597ee70dd4a881dd0dd88805d86a831222cc4b7",
          "bytes": 131235
        },
        "row_count": 7377
      }
    }
  ]
}
