{
  "schema_version": 1,
  "target": {
    "jurisdiction": "132241",
    "fiscal_year": 2023,
    "document_kind": "supplementary",
    "amendment_number": 10
  },
  "direction": "expenditure",
  "conversions": [
    {
      "id": "tama-supplementary-native-36b6b4b147ea4632",
      "converter": "fiscal/layouts/retained/convert.py",
      "inputs": [
        {
          "sha256": "305801ed076b907a76804a9d85c06fba1b163429f6e836e169de0bd01585b1eb"
        }
      ],
      "options": {
        "objects": [
          {
            "table_id": "tama-supplementary-native-36b6b4b147ea4632",
            "bytes": 164600,
            "key": "inputs/table/sha256/cca5cead807466db465694bae7fa630529626cd1c6817e6cf9190e5db21efaad",
            "sha256": "cca5cead807466db465694bae7fa630529626cd1c6817e6cf9190e5db21efaad"
          }
        ]
      },
      "expected_tables": [
        {
          "table_id": "tama-supplementary-native-36b6b4b147ea4632"
        }
      ]
    },
    {
      "id": "tama-supplementary-native-eb8bb013e434c59e",
      "converter": "fiscal/layouts/retained/convert.py",
      "inputs": [
        {
          "sha256": "305801ed076b907a76804a9d85c06fba1b163429f6e836e169de0bd01585b1eb"
        }
      ],
      "options": {
        "objects": [
          {
            "table_id": "tama-supplementary-native-eb8bb013e434c59e",
            "bytes": 72608,
            "key": "inputs/table/sha256/e90bccfa41f6d89ee2cd8626255e221491f9b11ea9a6d1fa2ed56f9ee8168da1",
            "sha256": "e90bccfa41f6d89ee2cd8626255e221491f9b11ea9a6d1fa2ed56f9ee8168da1"
          }
        ]
      },
      "expected_tables": [
        {
          "table_id": "tama-supplementary-native-eb8bb013e434c59e"
        }
      ]
    }
  ],
  "tables": [
    {
      "table_id": "tama-supplementary-native-36b6b4b147ea4632",
      "conversion_id": "tama-supplementary-native-36b6b4b147ea4632",
      "input_fingerprint": "1494965ced978858e96055231b0a1ad7608826c802185615cd4c4e996cddfb9f",
      "object": {
        "key": "fiscal/ingestion/132241/2023/supplementary-10/expenditure/tama-supplementary-native-36b6b4b147ea4632.parquet",
        "sha256": "cca5cead807466db465694bae7fa630529626cd1c6817e6cf9190e5db21efaad",
        "bytes": 164600
      },
      "row_count": 2069
    },
    {
      "table_id": "tama-supplementary-native-eb8bb013e434c59e",
      "conversion_id": "tama-supplementary-native-eb8bb013e434c59e",
      "input_fingerprint": "9629ac8ba54900a53155f6be145957802f0b8290c1c334ee8db0ca2715ddbadf",
      "object": {
        "key": "fiscal/ingestion/132241/2023/supplementary-10/expenditure/tama-supplementary-native-eb8bb013e434c59e.parquet",
        "sha256": "e90bccfa41f6d89ee2cd8626255e221491f9b11ea9a6d1fa2ed56f9ee8168da1",
        "bytes": 72608
      },
      "row_count": 639
    }
  ]
}
