{
  "schema_version": 1,
  "target": {
    "jurisdiction": "134015",
    "fiscal_year": 2025,
    "document_kind": "settlement"
  },
  "direction": "expenditure",
  "conversions": [
    {
      "id": "general-settlement",
      "converter": "fiscal/layouts/generic_text/convert.py",
      "inputs": [
        {
          "sha256": "06352a7e7e4c177d2a6a4f94378a5a5b82809bba3f9d6ebdaae42bead42e6b08"
        }
      ],
      "options": {
        "account": "一般会計",
        "table_id": "general-expenditure"
      },
      "expected_tables": [
        {
          "table_id": "general-expenditure"
        }
      ]
    },
    {
      "id": "long-term-care-settlement",
      "converter": "fiscal/layouts/generic_text/convert.py",
      "inputs": [
        {
          "sha256": "e1e01aba79941e5b1f650b426abfbb53053c36acb035f3a62315425085a60189"
        }
      ],
      "options": {
        "account": "介護保険特別会計",
        "table_id": "long-term-care-expenditure"
      },
      "expected_tables": [
        {
          "table_id": "long-term-care-expenditure"
        }
      ]
    }
  ],
  "tables": [
    {
      "table_id": "general-expenditure",
      "conversion_id": "general-settlement",
      "input_fingerprint": "54a0063333d7e6259df09723446634908ce78ec4867209c10496602c7ee0ba29",
      "account": "一般会計",
      "notes": [
        "汎用のノード生成機（docs/prd/generic-node-builder）が選定の scope の頁を罫線・見出し・字下げ・番号から読んだ。科目の段は bands、内訳の段は {'節': 'shape'}。",
        "金額の単位は printed 96頁 から決めた。款の和 10,922,732,928 と印字の「歳出合計」10,922,732,928 が一致。",
        "金額の注記 129 件（充用 3・流用 126）を注記軸に置いた。",
        "共有辞書に無い金額の見出し 1 種（883 件）を、印字された語から辞書の見出しに寄せた: 予算現額／節／金額→節／金額。"
      ],
      "unread_amount_count": 0,
      "unresolved_parent_count": 0,
      "nodes": {
        "object": {
          "key": "fiscal/ingestion/134015/2025/settlement/expenditure/general-expenditure-nodes.parquet",
          "sha256": "b37d01eadea3d129f16ea24d5e5a7645c88f928be510e77ddd69108ca71ab305",
          "bytes": 36004
        },
        "row_count": 1189
      },
      "amounts": {
        "object": {
          "key": "fiscal/ingestion/134015/2025/settlement/expenditure/general-expenditure-amounts.parquet",
          "sha256": "77638a13646a85e922144e406254400c5973d72de617ef9260645083e567a049",
          "bytes": 58781
        },
        "row_count": 5063
      }
    },
    {
      "table_id": "long-term-care-expenditure",
      "conversion_id": "long-term-care-settlement",
      "input_fingerprint": "2594df925e5d1586a19f59de1b97b6297fa34ad9174fd25d94331c3e4cdb003c",
      "account": "介護保険特別会計",
      "notes": [
        "汎用のノード生成機（docs/prd/generic-node-builder）が選定の scope の頁を罫線・見出し・字下げ・番号から読んだ。科目の段は bands、内訳の段は {'節': 'shape'}。",
        "金額の単位は printed 18頁 から決めた。款の和 1,022,840,739 と印字の「歳出合計」1,022,840,739 が一致。",
        "金額の注記 7 件（充用 1・流用 6）を注記軸に置いた。",
        "共有辞書に無い金額の見出し 1 種（75 件）を、印字された語から辞書の見出しに寄せた: 予算現額／節／金額→節／金額。"
      ],
      "unread_amount_count": 0,
      "unresolved_parent_count": 0,
      "nodes": {
        "object": {
          "key": "fiscal/ingestion/134015/2025/settlement/expenditure/long-term-care-expenditure-nodes.parquet",
          "sha256": "727797f9363abf34592196f89131b0190b316b1664df9b582cb99bb023a682c8",
          "bytes": 8887
        },
        "row_count": 155
      },
      "amounts": {
        "object": {
          "key": "fiscal/ingestion/134015/2025/settlement/expenditure/long-term-care-expenditure-amounts.parquet",
          "sha256": "24aecc97c86b2072b317f908b42a71356e04d4693dbb9307b064bd85848ef1da",
          "bytes": 10653
        },
        "row_count": 851
      }
    }
  ]
}
