{
  "schema_version": 1,
  "target": {
    "jurisdiction": "131032",
    "fiscal_year": 2024,
    "document_kind": "settlement"
  },
  "direction": "expenditure",
  "conversions": [
    {
      "id": "national-health-insurance-settlement",
      "converter": "fiscal/layouts/generic_text/convert.py",
      "inputs": [
        {
          "sha256": "8baaddb9e3359bfe1df6cb06b50d74b574d66d827ef30f7a1c52675a6b9623ab"
        }
      ],
      "options": {
        "account": "国民健康保険事業会計",
        "table_id": "national-health-insurance-expenditure"
      },
      "expected_tables": [
        {
          "table_id": "national-health-insurance-expenditure"
        }
      ]
    },
    {
      "id": "elderly-medical-settlement",
      "converter": "fiscal/layouts/generic_text/convert.py",
      "inputs": [
        {
          "sha256": "bd254af6e84696116bbda2587b60519a0526dcc806d30a9b1d20a33d5cd76d7c"
        }
      ],
      "options": {
        "account": "後期高齢者医療会計",
        "table_id": "elderly-medical-expenditure"
      },
      "expected_tables": [
        {
          "table_id": "elderly-medical-expenditure"
        }
      ]
    },
    {
      "id": "long-term-care-settlement",
      "converter": "fiscal/layouts/generic_text/convert.py",
      "inputs": [
        {
          "sha256": "3d28c25871a7ae58d49724a9138a28673e04f74f72ff3c6744e222537aaabc38"
        }
      ],
      "options": {
        "account": "介護保険会計",
        "table_id": "long-term-care-expenditure"
      },
      "expected_tables": [
        {
          "table_id": "long-term-care-expenditure"
        }
      ]
    },
    {
      "id": "general-settlement",
      "converter": "fiscal/layouts/generic_text/convert.py",
      "inputs": [
        {
          "sha256": "dbc461f9232c5f815e55e0663bf8268cf6339f1fd5b25773e06d9b3cc17ea1f4"
        }
      ],
      "options": {
        "account": "一般会計",
        "table_id": "general-expenditure"
      },
      "expected_tables": [
        {
          "table_id": "general-expenditure"
        }
      ]
    }
  ],
  "tables": [
    {
      "table_id": "national-health-insurance-expenditure",
      "conversion_id": "national-health-insurance-settlement",
      "input_fingerprint": "19a66fd627ae015f053e9b5dcb8f73e298ef6b66784429f5237fb89580dd1155",
      "account": "国民健康保険事業会計",
      "notes": [
        "汎用のノード生成機（docs/prd/generic-node-builder）が選定の scope の頁を罫線・見出し・字下げ・番号から読んだ。科目の段は bands、内訳の段は {'節': 'indent'}。",
        "金額の単位は column mark 10頁 から決めた。款の和 24,902,222,880 と印字の「歳出合計」24,902,222,880 が一致。",
        "金額の注記 10 件（充用 4・流用 6）を注記軸に置いた。",
        "共有辞書に無い金額の見出し 1 種（54 件）を、印字された語から辞書の見出しに寄せた: 予算現額／節／金額→節／金額。"
      ],
      "unread_amount_count": 0,
      "unresolved_parent_count": 0,
      "nodes": {
        "object": {
          "key": "fiscal/ingestion/131032/2024/settlement/expenditure/national-health-insurance-expenditure-nodes.parquet",
          "sha256": "a08ee9a4644a301f551baac0945850a1d75180bc34164d81efbb415783c28eff",
          "bytes": 7320
        },
        "row_count": 121
      },
      "amounts": {
        "object": {
          "key": "fiscal/ingestion/131032/2024/settlement/expenditure/national-health-insurance-expenditure-amounts.parquet",
          "sha256": "3865329e0f4d77852d8644569676a841b452fa2bc49b78863f9160faf16a8e53",
          "bytes": 9590
        },
        "row_count": 904
      }
    },
    {
      "table_id": "elderly-medical-expenditure",
      "conversion_id": "elderly-medical-settlement",
      "input_fingerprint": "5288ae254942f188fc7e80b72c4183f87ef4bbf17d6148b4038b99ef075c6775",
      "account": "後期高齢者医療会計",
      "notes": [
        "汎用のノード生成機（docs/prd/generic-node-builder）が選定の scope の頁を罫線・見出し・字下げ・番号から読んだ。科目の段は bands、内訳の段は {'節': 'indent'}。",
        "金額の単位は column mark 6頁 から決めた。款の和 7,178,034,355 と印字の「歳出合計」7,178,034,355 が一致。",
        "金額の注記 0 件（なし）を注記軸に置いた。",
        "共有辞書に無い金額の見出し 1 種（19 件）を、印字された語から辞書の見出しに寄せた: 予算現額／節／金額→節／金額。"
      ],
      "unread_amount_count": 0,
      "unresolved_parent_count": 0,
      "nodes": {
        "object": {
          "key": "fiscal/ingestion/131032/2024/settlement/expenditure/elderly-medical-expenditure-nodes.parquet",
          "sha256": "e2323a58ff0c07600c8a766453f039c1a20de3bfb52509b8c929325d65820130",
          "bytes": 3976
        },
        "row_count": 37
      },
      "amounts": {
        "object": {
          "key": "fiscal/ingestion/131032/2024/settlement/expenditure/elderly-medical-expenditure-amounts.parquet",
          "sha256": "259ccf59725ec2f6acbef1ca1124f49ad69bc53226850882fa2c99f9e74d9269",
          "bytes": 4426
        },
        "row_count": 294
      }
    },
    {
      "table_id": "long-term-care-expenditure",
      "conversion_id": "long-term-care-settlement",
      "input_fingerprint": "a0592fbe238d82bca0de4a26f5ac5892a629ea134afe416b482b81ace227d9fb",
      "account": "介護保険会計",
      "notes": [
        "汎用のノード生成機（docs/prd/generic-node-builder）が選定の scope の頁を罫線・見出し・字下げ・番号から読んだ。科目の段は bands、内訳の段は {'節': 'indent'}。",
        "金額の単位は column mark 6頁 から決めた。款の和 18,186,714,348 と印字の「歳出合計」18,186,714,348 が一致。",
        "金額の注記 0 件（なし）を注記軸に置いた。",
        "共有辞書に無い金額の見出し 1 種（37 件）を、印字された語から辞書の見出しに寄せた: 予算現額／節／金額→節／金額。"
      ],
      "unread_amount_count": 0,
      "unresolved_parent_count": 0,
      "nodes": {
        "object": {
          "key": "fiscal/ingestion/131032/2024/settlement/expenditure/long-term-care-expenditure-nodes.parquet",
          "sha256": "a0e873a73d9dc33f2a235036796f41806ea127fadba8bc83857e3d2cac210898",
          "bytes": 5362
        },
        "row_count": 67
      },
      "amounts": {
        "object": {
          "key": "fiscal/ingestion/131032/2024/settlement/expenditure/long-term-care-expenditure-amounts.parquet",
          "sha256": "da0c3aaed9edebf46af5dd4fddf5c44937700026cffaa16ce3fd4b3e3b642c37",
          "bytes": 6449
        },
        "row_count": 522
      }
    },
    {
      "table_id": "general-expenditure",
      "conversion_id": "general-settlement",
      "input_fingerprint": "7097fc65935f5e44d841006a63ef184c07bcfea691d0893e1d378bede6ffe2af",
      "account": "一般会計",
      "notes": [
        "汎用のノード生成機（docs/prd/generic-node-builder）が選定の scope の頁を罫線・見出し・字下げ・番号から読んだ。科目の段は bands、内訳の段は {'節': 'indent'}。",
        "金額の単位は column mark 59頁 から決めた。款の和 189,054,795,859 と印字の「歳出合計」189,054,795,859 が一致。",
        "金額の注記 178 件（不用額 24・充用 25・流用 129）を注記軸に置いた。",
        "共有辞書に無い金額の見出し 1 種（849 件）を、印字された語から辞書の見出しに寄せた: 予算現額／節／金額→節／金額。"
      ],
      "unread_amount_count": 0,
      "unresolved_parent_count": 0,
      "nodes": {
        "object": {
          "key": "fiscal/ingestion/131032/2024/settlement/expenditure/general-expenditure-nodes.parquet",
          "sha256": "3abfc5b79af8ed056befaecacb5ee7fd5e540ca9c6002c16970cc69df27b4b1a",
          "bytes": 30527
        },
        "row_count": 1184
      },
      "amounts": {
        "object": {
          "key": "fiscal/ingestion/131032/2024/settlement/expenditure/general-expenditure-amounts.parquet",
          "sha256": "32a1a95dc5c8e12cca19543f697bee4bab7504bcab275607fca0686678d8b25c",
          "bytes": 57260
        },
        "row_count": 6842
      }
    }
  ]
}
